{
  "products": [
    {
      "id": 1,
      "name": "LCI (Inter) 7445146 (LCI DI 360 - 110% do CDI - vencimento: 04/10/2021)",
      "broker": "Inter",
      "type": "LCI",
      "rate": "110%",
      "indexer": "CDI",
      "investment_date": "2020-10-07",
      "due_date": "2021-10-04",
      "initial_amount": 10000,
      "accrued_income": 169.18,
      "incomes": [
        { "2020-11-01": 28 },
        { "2020-12-01": 28.08 },
        { "2021-01-01": 28.16 },
        { "2021-02-01": 28.24 },
        { "2021-03-01": 28.31 },
        { "2021-04-01": 28.39 }
      ]
    },
    {
      "id": 2,
      "name": "LCI 12283631 (Inter) (LCI 98% do CDI - vencimento 17/08/2021)",
      "broker": "Inter",
      "type": "LCI",
      "rate": "98%",
      "indexer": "CDI",
      "investment_date": "2021-02-18",
      "due_date": "2021-08-17",
      "initial_amount": 173.73,
      "accrued_income": 0.97,
      "incomes": [{ "2021-03-01": 0.49 }, { "2021-04-01": 0.49 }]
    },
    {
      "id": 3,
      "name": "LCI (Inter) (IPCA + 3,71% - vencimento: 13/03/2026)",
      "broker": "Inter",
      "type": "LCI",
      "rate": "3,71%",
      "indexer": "IPCA",
      "investment_date": "2021-03-16",
      "due_date": "2026-03-13",
      "initial_amount": 572.21,
      "accrued_income": 1.6,
      "incomes": [{ "2021-04-01": 1.6 }]
    },
    {
      "id": 4,
      "name": "LCI 7445209 (Inter)(LCI DI 360 - 110% do CDI - vencimento: 04/10/2021)",
      "broker": "Inter",
      "type": "LCI",
      "rate": "110%",
      "indexer": "CDI",
      "investment_date": "2020-10-07",
      "due_date": "2021-10-04",
      "initial_amount": 40000.0,
      "accrued_income": 556.88,
      "incomes": [
        { "2020-11-01": 112.0 },
        { "2020-12-01": 112.31 },
        { "2021-01-01": 112.63 },
        { "2021-02-01": 112.94 },
        { "2021-03-01": 113.26 },
        { "2021-04-01": 113.58 }
      ]
    },
    {
      "id": 5,
      "name": "LCI (Inter) (LCI IPCA - 3,37% + IPCA - vencimento:23/03/2022",
      "broker": "Inter",
      "type": "LCI",
      "rate": "3,37%",
      "indexer": "IPCA",
      "investment_date": "2020-04-24",
      "due_date": "2022-03-23",
      "initial_amount": 3380.41,
      "accrued_income": 289.87,
      "incomes": [
        { "2020-04-01": 21.46 },
        { "2020-05-01": 21.6 },
        { "2020-06-01": 21.73 },
        { "2020-07-01": 21.87 },
        { "2020-08-01": 22.01 },
        { "2020-09-01": 22.15 },
        { "2020-10-01": 22.29 },
        { "2020-11-01": 22.43 },
        { "2020-12-01": 22.58 },
        { "2021-01-01": 22.72 },
        { "2021-02-01": 22.86 },
        { "2021-03-01": 23.01 },
        { "2021-04-01": 23.15 }
      ]
    },
    {
      "id": 6,
      "name": "LCI 1848240 (Inter) IPCA Final 3 anos - 3,64% + IPCA - vencimento: 25/05/2022",
      "broker": "Inter",
      "type": "LCI",
      "rate": "3,64%",
      "indexer": "IPCA",
      "investment_date": "2019-05-21",
      "due_date": "2022-05-25",
      "initial_amount": 7400,
      "accrued_income": 1294.83,
      "incomes": [
        { "2019-04-01": 48.53 },
        { "2019-05-01": 48.85 },
        { "2019-06-01": 49.17 },
        { "2019-07-01": 49.49 },
        { "2019-08-01": 49.82 },
        { "2019-09-01": 50.14 },
        { "2019-10-01": 50.47 },
        { "2019-11-01": 50.8 },
        { "2019-12-01": 51.14 },
        { "2020-01-01": 51.47 },
        { "2020-02-01": 51.81 },
        { "2020-03-01": 52.15 },
        { "2020-04-01": 52.49 },
        { "2020-05-01": 52.84 },
        { "2020-06-01": 53.18 },
        { "2020-07-01": 53.53 },
        { "2020-08-01": 53.88 },
        { "2020-09-01": 54.23 },
        { "2020-10-01": 54.59 },
        { "2020-11-01": 54.95 },
        { "2020-12-01": 55.31 },
        { "2021-01-01": 55.67 },
        { "2021-02-01": 56.04 },
        { "2021-03-01": 56.4 },
        { "2021-04-01": 56.77 }
      ]
    },
    {
      "id": 7,
      "name": "LCA Pré BTG Pactual (Inter) (6,35% - vencimento: 09/12/2024)",
      "broker": "Inter",
      "type": "LCA",
      "rate": "6,35%",
      "indexer": "PRE",
      "investment_date": "2021-01-08",
      "due_date": "2024-12-09",
      "initial_amount": 1001.22,
      "accrued_income": 22.01,
      "incomes": [
        { "2021-02-01": 5.15 },
        { "2021-03-01": 5.18 },
        { "2021-04-01": 5.2 }
      ]
    },
    {
      "id": 8,
      "name": "CDB Pos Liquidez Diária 3786434 (Inter)",
      "broker": "Inter",
      "type": "CDB",
      "rate": "102%",
      "indexer": "CDI",
      "investment_date": "2020-01-07",
      "due_date": "2022-01-31",
      "initial_amount": 15000,
      "accrued_income": 727.58,
      "incomes": [
        { "2019-12-01": 41.85 },
        { "2020-01-01": 41.97 },
        { "2020-02-01": 42.09 },
        { "2020-03-01": 42.2 },
        { "2020-04-01": 42.32 },
        { "2020-05-01": 42.44 },
        { "2020-06-01": 42.56 },
        { "2020-07-01": 42.68 },
        { "2020-08-01": 42.8 },
        { "2020-09-01": 42.91 },
        { "2020-10-01": 43.03 },
        { "2020-11-01": 43.15 },
        { "2020-12-01": 43.27 },
        { "2021-01-01": 43.4 },
        { "2021-02-01": 43.52 },
        { "2021-03-01": 43.64 },
        { "2021-04-01": 43.76 }
      ]
    },
    {
      "id": 9,
      "name": "CRA  Jalles Machado E21 (Inter) (4,4% + IPCA) - vencimento: 19/02/2026",
      "broker": "Inter",
      "type": "CRA",
      "rate": "4,40%",
      "indexer": "IPCA",
      "investment_date": "2020-10-13",
      "due_date": "2026-02-19",
      "initial_amount": 4143.72,
      "accrued_income": 180.86,
      "incomes": [
        { "2020-11-01": 29.61 },
        { "2020-12-01": 29.82 },
        { "2021-01-01": 30.03 },
        { "2021-02-01": 30.25 },
        { "2021-03-01": 30.47 },
        { "2021-04-01": 30.68 }
      ]
    },
    {
      "id": 10,
      "name": "LCI (Inter) (LCI IPCA - 5.67% + IPCA - vencimento: 09/06/2022",
      "broker": "Inter",
      "type": "LCI",
      "rate": "5,67%",
      "indexer": "IPCA",
      "investment_date": "2020-04-07",
      "due_date": "2022-06-09",
      "initial_amount": 2591.71,
      "accrued_income": 387.28,
      "incomes": [
        { "2020-04-01": 21.04 },
        { "2020-05-01": 21.21 },
        { "2020-06-01": 21.39 },
        { "2020-07-01": 21.56 },
        { "2020-08-01": 21.73 },
        { "2020-09-01": 21.91 },
        { "2020-10-01": 22.09 },
        { "2020-11-01": 22.27 },
        { "2020-12-01": 22.45 },
        { "2021-01-01": 22.63 },
        { "2021-02-01": 22.81 },
        { "2021-03-01": 23.0 },
        { "2021-04-01": 23.19 }
      ]
    },
    {
      "id": 11,
      "name": "LCI 1656032 (Inter) -  (LCI IPCA FINAL 3 ANOS - 3,77%+IPCA - vencimento: 26/04/2022)",
      "broker": "Inter",
      "type": "LCI",
      "rate": "3,77%",
      "indexer": "IPCA",
      "investment_date": "2019-04-22",
      "due_date": "2022-04-26",
      "initial_amount": 14432.77,
      "accrued_income": 2718.3,
      "incomes": [
        { "2019-03-01": 96.11 },
        { "2019-04-01": 96.75 },
        { "2019-05-01": 97.39 },
        { "2019-06-01": 98.04 },
        { "2019-07-01": 98.69 },
        { "2019-08-01": 99.35 },
        { "2019-09-01": 100.01 },
        { "2019-10-01": 100.68 },
        { "2019-11-01": 101.35 },
        { "2019-12-01": 102.02 },
        { "2020-01-01": 102.7 },
        { "2020-02-01": 103.39 },
        { "2020-03-01": 104.07 },
        { "2020-04-01": 104.77 },
        { "2020-05-01": 105.47 },
        { "2020-06-01": 106.17 },
        { "2020-07-01": 106.87 },
        { "2020-08-01": 107.59 },
        { "2020-09-01": 108.3 },
        { "2020-10-01": 109.02 },
        { "2020-11-01": 109.75 },
        { "2020-12-01": 110.48 },
        { "2021-01-01": 111.22 },
        { "2021-02-01": 111.96 },
        { "2021-03-01": 112.7 },
        { "2021-04-01": 113.45 }
      ]
    },
    {
      "id": 12,
      "name": "LCI 412277 (Inter) -  (LCI IPCA FINAL 5 ANOS - 5,47 + IPCA - vencimento: 27/06/2022)",
      "broker": "Inter",
      "type": "LCI",
      "rate": "5,47%",
      "indexer": "IPCA",
      "investment_date": "2017-06-27",
      "due_date": "2022-06-27",
      "initial_amount": 3000,
      "accrued_income": 1390.7,
      "incomes": [
        { "2017-05-01": 23.9 },
        { "2017-06-01": 24.09 },
        { "2017-07-01": 24.28 },
        { "2017-08-01": 24.48 },
        { "2017-09-01": 24.67 },
        { "2017-10-01": 24.87 },
        { "2017-11-01": 25.06 },
        { "2017-12-01": 25.26 },
        { "2018-01-01": 25.47 },
        { "2018-02-01": 25.67 },
        { "2018-03-01": 25.87 },
        { "2018-04-01": 26.08 },
        { "2018-05-01": 26.29 },
        { "2018-06-01": 26.5 },
        { "2018-07-01": 26.71 },
        { "2018-08-01": 26.92 },
        { "2018-09-01": 27.13 },
        { "2018-10-01": 27.35 },
        { "2018-11-01": 27.57 },
        { "2018-12-01": 27.79 },
        { "2019-01-01": 28.01 },
        { "2019-02-01": 28.23 },
        { "2019-03-01": 28.46 },
        { "2019-04-01": 28.68 },
        { "2019-05-01": 28.91 },
        { "2019-06-01": 29.14 },
        { "2019-07-01": 29.38 },
        { "2019-08-01": 29.61 },
        { "2019-09-01": 29.85 },
        { "2019-10-01": 30.08 },
        { "2019-11-01": 30.32 },
        { "2019-12-01": 30.56 },
        { "2020-01-01": 30.81 },
        { "2020-02-01": 31.05 },
        { "2020-03-01": 31.3 },
        { "2020-04-01": 31.55 },
        { "2020-05-01": 31.8 },
        { "2020-06-01": 32.05 },
        { "2020-07-01": 32.31 },
        { "2020-08-01": 32.57 },
        { "2020-09-01": 32.83 },
        { "2020-10-01": 33.09 },
        { "2020-11-01": 33.35 },
        { "2020-12-01": 33.62 },
        { "2021-01-01": 33.89 },
        { "2021-02-01": 34.16 },
        { "2021-03-01": 34.43 },
        { "2021-04-01": 34.7 }
      ]
    },
    {
      "id": 13,
      "name": "LCI 1334865 (Inter) - (LCI IPCA FINAL 5 ANOS - 4,75% + IPCA - vencimento: 21/02/2024)",
      "broker": "Inter",
      "type": "LCI",
      "rate": "4,75%",
      "indexer": "IPCA",
      "investment_date": "2019-02-21",
      "due_date": "2024-02-21",
      "initial_amount": 34450.0,
      "accrued_income": 7916.71,
      "incomes": [
        { "2019-01-01": 255.45 },
        { "2019-02-01": 257.34 },
        { "2019-03-01": 259.25 },
        { "2019-04-01": 261.17 },
        { "2019-05-01": 263.11 },
        { "2019-06-01": 265.06 },
        { "2019-07-01": 267.02 },
        { "2019-08-01": 269.0 },
        { "2019-09-01": 271.0 },
        { "2019-10-01": 273.01 },
        { "2019-11-01": 275.03 },
        { "2020-12-01": 277.07 },
        { "2020-01-01": 279.13 },
        { "2020-02-01": 281.2 },
        { "2020-03-01": 283.28 },
        { "2020-04-01": 285.38 },
        { "2020-05-01": 287.5 },
        { "2020-06-01": 289.63 },
        { "2020-07-01": 291.78 },
        { "2020-08-01": 293.94 },
        { "2020-09-01": 296.12 },
        { "2020-10-01": 298.32 },
        { "2020-11-01": 300.53 },
        { "2020-12-01": 302.76 },
        { "2021-01-01": 305.0 },
        { "2021-02-01": 307.26 },
        { "2021-03-01": 309.54 },
        { "2021-04-01": 311.84 }
      ]
    },
    {
      "id": 14,
      "name": "LCI 589271 (Inter) - (LCI IPCA FINAL 5 ANOS - 5,36% + IPCA - vencimento: 19/12/2022)",
      "broker": "Inter",
      "type": "LCI",
      "rate": "5,36%",
      "indexer": "IPCA",
      "investment_date": "2017-12-18",
      "due_date": "2022-12-19",
      "initial_amount": 8200,
      "accrued_income": 3203.26,
      "incomes": [
        { "2017-11-01": 64.64 },
        { "2017-12-01": 65.15 },
        { "2018-01-01": 65.66 },
        { "2018-02-01": 66.18 },
        { "2018-03-01": 66.7 },
        { "2018-04-01": 67.22 },
        { "2018-05-01": 67.75 },
        { "2018-06-01": 68.29 },
        { "2018-07-01": 68.83 },
        { "2018-08-01": 69.37 },
        { "2018-09-01": 69.92 },
        { "2018-10-01": 70.47 },
        { "2019-11-01": 71.02 },
        { "2019-12-01": 71.58 },
        { "2019-01-01": 72.15 },
        { "2019-02-01": 72.71 },
        { "2019-03-01": 73.29 },
        { "2019-04-01": 73.87 },
        { "2019-05-01": 74.45 },
        { "2019-06-01": 75.03 },
        { "2019-07-01": 75.63 },
        { "2019-08-01": 76.22 },
        { "2019-09-01": 76.82 },
        { "2019-10-01": 77.43 },
        { "2019-11-01": 78.04 },
        { "2019-12-01": 78.65 },
        { "2020-01-01": 79.27 },
        { "2020-02-01": 79.9 },
        { "2020-03-01": 80.53 },
        { "2020-04-01": 81.16 },
        { "2020-05-01": 81.8 },
        { "2020-06-01": 82.45 },
        { "2020-07-01": 83.1 },
        { "2020-08-01": 83.75 },
        { "2020-09-01": 84.41 },
        { "2020-10-01": 85.08 },
        { "2020-11-01": 85.75 },
        { "2020-12-01": 86.43 },
        { "2021-01-01": 87.11 },
        { "2021-02-01": 87.79 },
        { "2021-03-01": 88.49 },
        { "2021-04-01": 89.18 }
      ]
    },
    {
      "id": 15,
      "name": "Debênture (Inter) LAMEA6 - 5% + IPVA - vencimento: 15/10/2030)",
      "broker": "Inter",
      "type": "Debênture",
      "rate": "5,00%",
      "indexer": "IPCA",
      "investment_date": "2021-01-29",
      "due_date": "2030-10-15",
      "initial_amount": 4989.52,
      "accrued_income": 114.73,
      "incomes": [
        { "2021-02-01": 37.95 },
        { "2021-03-01": 38.24 },
        { "2021-04-01": 38.53 }
      ]
    },
    {
      "id": 16,
      "name": "Debênture Incentivada (Inter) (IGSN15 - 4,85% + IPCA - vencimento:15/07/2034)",
      "broker": "Inter",
      "type": "Debênture",
      "rate": "4,85%",
      "indexer": "IPCA",
      "investment_date": "2020-09-03",
      "due_date": "2034-07-15",
      "initial_amount": 3000,
      "accrued_income": 184.59,
      "incomes": [
        { "2020-09-01": 22.48 },
        { "2020-10-01": 22.64 },
        { "2020-11-01": 22.81 },
        { "2020-12-01": 22.98 },
        { "2021-01-01": 23.16 },
        { "2021-02-01": 23.33 },
        { "2021-03-01": 23.5 },
        { "2021-04-01": 23.68 }
      ]
    },
    {
      "id": 17,
      "name": "Debênture Incentivada (Inter) (IGSN15 - 4,92% + IPCA - vencimento:15/07/2034)",
      "broker": "Inter",
      "type": "Debênture",
      "rate": "4,92%",
      "indexer": "IPCA",
      "investment_date": "2020-09-28",
      "due_date": "2034-07-15",
      "initial_amount": 15000,
      "accrued_income": 929.74,
      "incomes": [
        { "2020-09-01": 113.18 },
        { "2020-10-01": 114.04 },
        { "2020-11-01": 114.9 },
        { "2020-12-01": 115.76 },
        { "2021-01-01": 116.64 },
        { "2021-02-01": 117.52 },
        { "2021-03-01": 118.4 },
        { "2021-04-01": 119.3 }
      ]
    }
  ]
}
